id,title,link,authors,abstract,type
1,[Best Paper] A Declarative Specification for Authoring Metrics Dashboards,,"Will Epperson, Kanit Wongsuphasawat, Allison Whilden, Fan Du, Justin Talbot","Despite their ubiquity, authoring dashboards for metrics reporting in modern data analysis tools remains a manual, time-consuming process. Rather than focusing on interesting combinations of their data, users have to spend time creating each chart in a dashboard one by one. This makes dashboard creation slow and tedious. We conducted a review of production metrics dashboards and found that many dashboards contain a common structure: breaking down one or more metrics by different dimensions. In response, we developed a high-level specification for describing dashboards as sections of metrics repeated across the same dimensions and a graphical interface, Quick Dashboard, for authoring dashboards based on this specification. We present several usage examples that demonstrate the flexibility of this specification to create various kinds of dashboards and support a data-first approach to dashboard authoring",Paper
2,Aardvark: Comparative Visualization of Data Analysis Scripts,,"Rebecca Faust, Carlos Scheidegger, Chris North","Debugging programs is famously one of the most challenging aspects of programming. Data analysis scripts present additional challenges as debugging tasks are often more exploratory, such as comparing results under different parameter settings. In fact, a common exploratory debugging process is to run, modify, and re-run a script to observe the effects of the change. Analyst’s perform this process repeatedly as they explore different settings in their script. However, traditional debugging methods do not support direct comparison across script executions. To address this, we present Aardvark, a comparative trace-based debugging method for identifying and visualizing the differences between consecutive executions of analysis scripts. Aardvark traces two consecutive instances of a script, identifies the differences between them, and presents them through comparative visualizations. We present a prototype implementation in Python along with an extension to Jupyter notebooks and demonstrate Aardvark through two usage scenarios on real world analysis scripts.",Paper
3,Visual Comparison of Text Sequences Generated by Large Language Models,,"Rita Sevastjanova, Simon Vogelbacher, Andreas Spitz, Daniel Keim, Mennatallah El-Assady","Causal language models have emerged as the leading technology for automating text generation tasks. Although these models tend to produce outputs that resemble human writing, they still suffer from quality issues (e.g., social biases). Researchers typically use automatic analysis methods to evaluate the model limitations, such as statistics on stereotypical words. Since different types of issues are embedded in the model parameters, the development of automated methods that capture all relevant aspects remains a challenge. To tackle this challenge, we propose a visual analytics approach that supports the exploratory analysis of text sequences generated by causal language models. Our approach enables users to specify starting prompts and effectively groups the resulting text sequences. To this end, we leverage a unified, ontology-driven embedding space, serving as a shared foundation for the thematic concepts present in the generated text sequences. Visual summaries provide insights into various levels of granularity within the generated data. Among others, we propose a novel comparison visualization that slices the embedding space and represents the differences between two prompt outputs in a radial layout. We demonstrate the effectiveness of our approach through case studies, showcasing its potential to reveal model biases and other quality issues.",Paper
4,HPC ClusterScape: Increasing Transparency and Efficiency of Shared High-Performance Computing Clusters for Large-scale AI Models,,"Heungseok Park, Aeree Cho, Hyojun Jeon, Hayoung Lee, Youngil Yang, Sungjae Lee, Heungsub Lee, Jaegul Choo","The emergence of large-scale AI models, like GPT-4, has significantly impacted academia and industry, driving the demand for high-performance computing (HPC) to accelerate workloads. To address this, we present HPCClusterScape, a visualization system that enhances the efficiency and transparency of shared HPC clusters for large-scale AI models. HPCClusterScape provides a comprehensive overview of system-level (e.g., partitions, hosts, and workload status) and application-level (e.g., identification of experiments and researchers) information, allowing HPC operators and machine learning researchers to monitor resource utilization and identify issues through customizable violation rules. The system includes diagnostic tools to investigate workload imbalances and synchronization bottlenecks in large-scale distributed deep learning experiments. Deployed in industrial-scale HPC clusters, HPCClusterScape incorporates user feedback and meets specific requirements. This paper outlines the challenges and prerequisites for efficient HPC operation, introduces the interactive visualization system, and highlights its contributions in addressing pain points and optimizing resource utilization in shared HPC clusters.",Paper
5,NeighViz: Towards Better Understanding of Neighborhood Effects on Social Groups with Spatial Data,,"Yue Yu, Yifang Wang, Qisen Yang, Di Weng, Yongjun Zhang, Xiaogang Wu, Yingcai Wu, Huamin Qu","Understanding how local environments influence individual behaviors, such as voting patterns or suicidal tendencies, is crucial in social science to reveal and reduce spatial disparities and promote social well-being. With the increasing availability of large-scale individual-level census data, new analytical opportunities arise for social scientists to explore human behaviors (e.g., political engagement) among social groups at a fine-grained level. However, traditional statistical methods mostly focus on global, aggregated spatial correlations, which are limited to understanding and comparing the impact of local environments (e.g., neighborhoods) on human behaviors among social groups. In this study, we introduce a new analytical framework for analyzing multi-variate neighborhood effects between social groups. We then propose NeighViz, an interactive visual analytics system that helps social scientists explore, understand, and verify the influence of neighborhood effects on human behaviors. Finally, we use a case study to illustrate the effectiveness and usability of our system.",Paper


